{
  "documentId": "protect-document-json",
  "documentType": "Hook",
  "schemaRef": "HookSchema/v1",
  "hookKind": "self-contained",
  "status": "ACTIVE",
  "content": {
    "title": {
      "blockType": "Title",
      "title": "protect-document-json"
    },
    "purpose": {
      "blockType": "Purpose",
      "title": "目的",
      "text": "document.json直接編集の禁止というCLAUDE.mdの運用ルールを機械的に強制する。"
    },
    "trigger": {
      "blockType": "Trigger",
      "title": "いつ働くか",
      "text": "Edit/Write操作の直前"
    },
    "behavior": {
      "blockType": "Behavior",
      "title": "判定ロジック",
      "text": "Edit/Writeツールの対象パスが.waffle/documents/配下の.jsonファイルに一致する場合、常に拒否する。document.jsonはCLI/MCP経由（scaffold fill / clear_field / patch-schema）で編集すべきというCLAUDE.mdの運用ルールを、Edit/Write呼び出しの時点で機械的に強制する。例外は無い。"
    },
    "scriptRef": {
      "blockType": "ScriptRef",
      "title": "スクリプト実体",
      "text": ".waffle/hooks/protect-document-json.py"
    },
    "guardrails": {
      "blockType": "Guardrails",
      "title": "ガードレール",
      "items": [
        "例外を設けない（schemaファイル側は対象外だが、document.jsonには一切の例外を作らない）"
      ]
    }
  }
}
